<!ELEMENT ENVIRONMENT (AGENTS,OBJECTS)>

<!ELEMENT AGENTS (AGENT)*>
<!ELEMENT OBJECTS (OBJECT)*>
<!ELEMENT AGENT EMPTY>
<!ELEMENT OBJECT EMPTY>

<!ATTLIST AGENT name			CDATA	#REQUIRED>
<!ATTLIST AGENT character		CDATA	#REQUIRED>
<!ATTLIST AGENT position_x		CDATA	"0">
<!ATTLIST AGENT position_y		CDATA	"0">
<!ATTLIST AGENT position_z		CDATA	"0">
<!ATTLIST AGENT rotation_x		CDATA	"0">
<!ATTLIST AGENT rotation_y		CDATA	"0">
<!ATTLIST AGENT rotation_z		CDATA	"0">

<!ATTLIST OBJECT name			CDATA	#REQUIRED>
<!ATTLIST OBJECT object_shape		CDATA	#REQUIRED>
<!ATTLIST OBJECT position_x		CDATA	"0">
<!ATTLIST OBJECT position_y		CDATA	"0">
<!ATTLIST OBJECT position_z		CDATA	"0">
<!ATTLIST OBJECT rotation_x		CDATA	"0">
<!ATTLIST OBJECT rotation_y		CDATA	"0">
<!ATTLIST OBJECT rotation_z		CDATA	"0">
